[
  {
    "id": "su-roman-001",
    "module": "roman",
    "type": "dissertation",
    "title": "Manon, un personnage condamnable ?",
    "oeuvre": "Abbé Prévost, Histoire du chevalier des Grieux et de Manon Lescaut (1731)",
    "parcours": "Personnages en marge, plaisirs du romanesque",
    "difficulty": 3,
    "estimatedMinutes": 120,
    "consigne": "Dans quelle mesure peut-on dire que Manon est un personnage condamnable ? Vous répondrez à cette question dans un développement argumenté, en vous appuyant sur l'œuvre de l'abbé Prévost et sur le parcours « Personnages en marge, plaisirs du romanesque ».",
    "methodeRappel": "Dissertation sur œuvre : **introduction** (accroche, présentation du sujet, problématique, annonce du plan) → **développement** dialectique (thèse / antithèse / dépassement), chaque partie appuyée sur des **exemples précis** de l'œuvre → **conclusion** (bilan + ouverture). Évitez la paraphrase : il faut **interpréter** les épisodes, non les raconter.",
    "steps": [
      {
        "id": "e1",
        "label": "Introduction — analyse du sujet et problématique",
        "statement": "Rédigez l'introduction : situez l'œuvre, dégagez l'enjeu du mot « condamnable », posez la problématique et annoncez le plan.",
        "hints": [
          "« Condamnable » suppose un jugement moral : qui juge, et selon quels critères ?",
          "Rappelez que Manon n'est vue qu'à travers les yeux de des Grieux.",
          "Problématique possible : le récit nous invite-t-il vraiment à condamner Manon, ou à la comprendre ?"
        ],
        "expectedAnswer": "Problématique : le roman conduit-il le lecteur à condamner Manon, ou la marginalité du personnage et le plaisir romanesque suspendent-ils le jugement moral ?",
        "solution": "On peut situer l'œuvre : roman-mémoires de l'**abbé Prévost** (1731), où le **chevalier des Grieux** raconte sa passion pour **Manon**, jeune femme galante. Le sujet invite à interroger le **jugement moral** porté sur l'héroïne. Or Manon n'est connue **qu'à travers le regard amoureux de des Grieux** : ce point de vue partial complique toute condamnation. **Problématique** : le récit nous pousse-t-il à condamner Manon, ou la séduction romanesque et l'ambiguïté du personnage suspendent-elles ce jugement ? **Plan** : I. Une conduite objectivement condamnable ; II. Un personnage qui échappe pourtant à la condamnation ; III. Une ambiguïté qui fait le plaisir du romanesque."
      },
      {
        "id": "e2",
        "label": "Axe I — Une conduite condamnable",
        "statement": "Montrez que, sur le plan moral et social, le comportement de Manon paraît condamnable.",
        "hints": [
          "Pensez à l'inconstance et à l'attrait du luxe et de l'argent.",
          "Quels épisodes montrent qu'elle trahit des Grieux ?"
        ],
        "expectedAnswer": "Inconstance, vénalité, trahisons (B..., G... M...) : Manon transgresse les normes morales et sociales et entraîne des Grieux dans la déchéance.",
        "solution": "Manon est une femme **galante** et **inconstante**, attirée par le **plaisir** et le **luxe**. Dès que l'argent manque, elle se tourne vers de **riches protecteurs** (l'épisode de B..., puis du jeune G... M...) et **trahit** des Grieux. Sa conduite transgresse les **normes morales et sociales** de son temps et entraîne le chevalier dans la **déchéance** (jeu, tricherie, prison). De ce point de vue, conforme à l'*Avis de l'auteur* qui annonce un exemple des dangers de la passion, Manon apparaît bien comme un personnage **moralement condamnable**."
      },
      {
        "id": "e3",
        "label": "Axe II — Un personnage qui échappe au jugement",
        "statement": "Montrez que le roman empêche pourtant le lecteur de condamner simplement Manon.",
        "hints": [
          "Manon aime-t-elle aussi des Grieux ? Le suit-elle dans le malheur ?",
          "Le point de vue narratif est-il neutre ? Quelle émotion la fin suscite-t-elle ?"
        ],
        "expectedAnswer": "Manon aime des Grieux, le suit dans la déportation et meurt à ses côtés ; le pathétique final et le regard amoureux du narrateur suscitent la compassion plutôt que la condamnation.",
        "solution": "Manon n'est pas qu'une calculatrice : elle est aussi **attachée** à des Grieux, qu'elle ne quitte jamais durablement et qu'elle suit jusque dans la **déportation** en Louisiane. La **mort** de Manon dans le désert d'Amérique, ensevelie par des Grieux, relève du **registre pathétique** : elle suscite la **pitié** bien plus que la réprobation. De plus, le récit étant mené par le **regard amoureux** de des Grieux, le lecteur est conduit à **comprendre** et à **plaindre** Manon. Le personnage **échappe** ainsi au jugement moral simple."
      },
      {
        "id": "e4",
        "label": "Axe III — L'ambiguïté, source du plaisir romanesque",
        "statement": "Montrez que c'est précisément l'ambiguïté de Manon qui fait sa force romanesque, en lien avec le parcours.",
        "hints": [
          "Un personnage parfaitement bon ou parfaitement mauvais serait-il aussi fascinant ?",
          "Reliez à « plaisirs du romanesque » : émotion, ambiguïté, séduction du récit."
        ],
        "expectedAnswer": "L'opacité et l'ambiguïté de Manon en font un personnage fascinant : le plaisir du romanesque naît de cette tension entre charme et faute, et de l'hésitation du lecteur entre condamnation et compassion.",
        "solution": "L'intériorité de Manon restant **opaque** (on n'accède jamais directement à ses pensées), le personnage demeure **ambigu** : ni tout à fait coupable, ni tout à fait innocente. C'est cette ambiguïté qui fait sa **puissance romanesque** : un personnage manichéen serait moins **fascinant**. Le parcours **« Personnages en marge, plaisirs du romanesque »** éclaire ce paradoxe : le plaisir de lecture naît de l'**émotion** et de l'**hésitation morale**, le lecteur oscillant entre condamnation et compassion. Juger Manon, ce serait renoncer au plaisir même du roman."
      },
      {
        "id": "e5",
        "label": "Conclusion et ouverture",
        "statement": "Rédigez la conclusion : faites le bilan et proposez une ouverture.",
        "hints": [
          "Répondez nettement à la problématique en nuançant le mot « condamnable ».",
          "Ouverture possible : d'autres héroïnes ambiguës du roman (Emma Bovary, par exemple)."
        ],
        "expectedAnswer": "Bilan : Manon est condamnable par sa conduite mais le roman suspend le jugement au profit de la compassion et du plaisir romanesque. Ouverture vers une autre héroïne ambiguë.",
        "solution": "**Bilan** : la conduite de Manon est objectivement **condamnable**, mais le roman, par le point de vue amoureux du narrateur et par le **pathétique** du dénouement, suspend ce jugement au profit de la **compassion** et du **plaisir romanesque**. Manon est moins un exemple à condamner qu'un personnage **ambigu** qui fascine. **Ouverture** : on retrouve cette ambiguïté féconde chez d'autres héroïnes du roman, telle Emma Bovary chez Flaubert (*Madame Bovary*, 1857), femme en marge des conventions que le récit fait à la fois juger et plaindre."
      }
    ],
    "tags": ["dissertation", "manon", "morale", "ambiguite", "marge"],
    "order": 1
  },
  {
    "id": "su-roman-002",
    "module": "roman",
    "type": "dissertation",
    "title": "Les plaisirs du romanesque : pourquoi un récit immoral séduit-il ?",
    "oeuvre": "Abbé Prévost, Histoire du chevalier des Grieux et de Manon Lescaut (1731)",
    "parcours": "Personnages en marge, plaisirs du romanesque",
    "difficulty": 3,
    "estimatedMinutes": 120,
    "consigne": "L'*Avis de l'auteur* présente *Manon Lescaut* comme un exemple moral, mais le roman fait surtout aimer des personnages en marge. Comment expliquez-vous que ce récit, jugé immoral, procure au lecteur un tel plaisir ? Vous répondrez en vous appuyant sur l'œuvre et sur le parcours « Personnages en marge, plaisirs du romanesque ».",
    "methodeRappel": "Plan possible : **analytique** (les différentes sources du plaisir romanesque) ou **dialectique** (la visée morale affichée / la séduction réelle du récit / leur tension féconde). Appuyez chaque idée sur des exemples **précis** de l'œuvre.",
    "steps": [
      {
        "id": "e1",
        "label": "Introduction — problématique",
        "statement": "Rédigez l'introduction : posez la tension entre visée morale et plaisir de lecture, formulez la problématique et annoncez le plan.",
        "hints": [
          "Opposez la promesse morale de l'Avis de l'auteur à la fascination réelle exercée par le récit.",
          "Problématique : d'où vient le plaisir pris à un récit pourtant immoral ?"
        ],
        "expectedAnswer": "Problématique : comment un récit qui se prétend moral mais peint des personnages en marge parvient-il à séduire le lecteur ? D'où vient ce plaisir du romanesque ?",
        "solution": "Dans son **Avis de l'auteur**, Prévost annonce un **exemple moral** censé montrer les dangers des passions. Pourtant, le roman fait surtout **aimer** des personnages condamnables. **Problématique** : comment un récit jugé immoral procure-t-il au lecteur un tel **plaisir** ? **Plan** : I. Le plaisir de l'aventure et de l'émotion ; II. Le plaisir de l'ambiguïté morale ; III. Une tension féconde entre leçon affichée et séduction du récit."
      },
      {
        "id": "e2",
        "label": "Axe I — Le plaisir de l'aventure et de l'émotion",
        "statement": "Montrez que le récit séduit d'abord par ses péripéties et par l'émotion qu'il suscite.",
        "hints": [
          "Pensez aux rebondissements : fuites, prison, évasion, déportation.",
          "Pensez à la force émotionnelle du dénouement."
        ],
        "expectedAnswer": "Rebondissements (jeu, prison, évasion, déportation) et intensité émotionnelle (passion, pathétique de la mort de Manon) procurent un plaisir de lecture immédiat.",